scientific_name,description,plant_care
rhododendron,"The Azalea plants have delicate, funnel shaped, lipped flowers in various colors and even bi-color. The are a popular houseplant with terminal blooms, meaning the entire plant flowers at one time. Indoor Azaleas and outdoor Azaleas are different and indoor ones do not do well planted outdoors.
The Azalea is a descendent of Asian shurbs, part of an ancient group of plants, millions of years old. It is the national flower of Nepal.
These plants are considered poisonous and should be kept away from the reach of children and pets.

Source:
https://www.houseplant411.com/houseplant/azalea-plant-how-to-grow-care-guide","Light: Bright, indirect light and no direct sun, while blooming. Without enough light, the flower buds won't open.
Water: Allow the top 2""-3"" of soil to dry before watering. Likes acidic water; if your water is alkaline, add one tablespoon of vinegar to each gallon of water. Can use leftover tea to water Azaleas.
Fertilizer: Feed monthly with an acidic fertilizer diluted to 1/3 strength.
Temperature: 50°-60°F, 10°-15.6°C, at night and 60°-70°F, 15.6°-21.1°C during the day
Humidity: Does well in normal to high humidity. Average humidity is about 40%.
Soil: Use a rich, acidic, well-draining planting mixture.
Pot: Can be found in 4"", 6"", and 8"".
Pruning: Remove dead flowers as soon as they appear. Remove dead and bare branches.
Propagation: Propagate by stem cuttings, and grafts.
Poisonous Plant Info: All parts are poisonous, containing grayanotoxin, which is very toxic. Keep away from children and pets.

Source:
https://www.houseplant411.com/houseplant/azalea-plant-how-to-grow-care-guide"
helxine soleirolii,"The Baby's Tears plant  is a very delicate looking houseplant with tiny, green leaves on fragile looking stems. Baby's Tears only gorws to about 2″-5″ tall, but it can spread to over 6' wide, often considered invasive ground cover. As an indoor houseplant, it requires attention and is not very forgiving. Care must be taken in low light settings to barely moisten the soil, feeding heavily in spring and summer, and using a loose, quick-draining soil. 
The plant originates from Italy, Corsica, Sardinia, and throughout the northern Mediterranean area.
It is on-toxic.

Source: 
https://www.houseplant411.com/houseplant/babys-tears-plant-how-to-grow-care-guide","Light: Bright, indirect light. No direct sun.
Water: Keep soil moist, but never soggy, else the roots and stems die.
Fertilizer: Spring-Summer: Feed every two weeks while actively growing with a balanced fertilizer diluted to 1/2 strength.
Temperature: 60°-75°F, 15.6°-23.9°C
Humidity: High humidity and good air circulation.
Soil: Use a quick-draining, well-aerated potting soil that contains a good amount of peat moss.
Pot: Usually found in 4"" or 6"" pots.
Pruning: Trim a Baby's Tears plant to keep its shape and fullness.
Propagation: Propagate by plant division and stem cuttings.
Poisonous Plant Info: Non-toxic

Source: 
https://www.houseplant411.com/houseplant/babys-tears-plant-how-to-grow-care-guide"
chamaedorea seifrizii,"The Bamboo Palm is a popular, compact, easy to care for, tropical looking plant that grows well in medium light and can grow well in lower light. The Bamboo Palm plant is actually not related to the real bamboo, which is a type of grass requiring very bright light. The Bamboo Palm has reed-like stems that resemble the real bamboo, with about 10-15 fronds on each stem. Each frond has 10-14 pinnate (feathery), dark-green leaflets. It can grow to a height of 5'-7' and a width of 3-5'.
The Bamboo Palm is native to the tropical and subtropical parts of Mexico and Central America and are relatively small, compared to other palms growing in the forest, reaching a height of only about 5ft-20ft (1.5m-6m). 
It is a slightly poisonous plant and should be kept away from small children.

Source:
https://www.houseplant411.com/houseplant/bamboo-palm-how-to-grow-care-guide","Light: Bright, indirect light is best. Does well in medium light. Grows very slowly in low light, without over-watering.
Water: Allow the top 1/3 of the soil of a bamboo palm to dry out, then water. Likes barely moist, never soggy soil. Do not let the plant sit in excess water.
Fertilizer: Spring-Summer: feed monthly with a high nitrogen fertilizer diluted to 1/2 strength. Do not fertilize when not actively growing of if the soil is very dry.
Temperature: 65°-80°F, 18.3°-26.7°C
Humidity: Likes high humidity; can still do well in average humidity.
Soil: Use a quick-draining, well-aerated potting soil that still retains moisture.
Pot: Re-pot when the roots have filled the current pot, using the next size pot and not larger.
Pruning: Cut brown leaf tips with wet scissors; remove bare stalks. Clean scissors after using to prevent diseases spreading from plant to plant.
Propagation: Propagate from seeds. This takes 2-5 years for a bamboo plant to reach a decent size.
Poisonous Plant Info: A bamboo palm is a slightly poisonous plant and should be kept away from small children.


Source:
https://www.houseplant411.com/houseplant/bamboo-palm-how-to-grow-care-guide"
gebera jamesonii,"The Barberton daisy is the common name for the Gebera Jamesonii, a popular flowering pot plant. There are many varieties and hybrids of the Barberton Daisy, in a wide range of flower colors. The basic type has stalks that can grow up to 2' tall.
The Barberton daisy is native to South Africa this species is grown as perennial in warmer climates and an annual in cooler climates.
It is non-toxic for cats, dogs and horses.

Source: 
https://www.houseplantsexpert.com/barberton-daisy.html","Light: Direct sunlight. Place at a south-, east- or west-facing window.
Water: Keep the soil moist all times. Once the soil is slightly dry to the touch, water the plant.
Fertilizer: While flowering, feed every two weeks with a balanced liquid fertilizer.
Temperature: 55°-75°F, 13°-24°C
Humidity: Average to above average.
Soil: Use a peat-based potting mix: 2 parts peat and 1 part perlite.
Pot: Re-pot every two years in the spring, if the plant has outgrown the current pot.
Pruning: When a flower wilts, cut back the stem to the leaves.
Propagation: Propagate with seeds.
Poisonous Plant Info: Non-toxic

Source: 
https://www.houseplantsexpert.com/barberton-daisy.html"
hymenocallis littoralis,"The Beach Spider Lily, Hymenocallis littoralis, are so named because the flowers lok like spiders. With proper care, including plenty of water and sunlight and a unique soil blend, the stems can grow to almost 2' tall, adding another foot in length when it fully blooms. The flowers give off a strong vanilla scent.
The Beach Spider Lily requires a large pot, a half-gallon or larger, the first year of life, needing re-potting to larger pots as it matures.
It originates from South Mexico and Central America.
The Beach Spider Lily is non-toxic.

Source:
https://www.houseplantsexpert.com/beach-spider-lily.html","Light: Partial shade to full sun.
Water: Soil should be kept moist, but never soggy. Do not allow plant to stand in excess water.
Fertilizer: Feed every two weeks with a diluted, balanced fertilizer.
Temperature: Protect from frost. Capable of withstanding temperatures that drop into the 40ºF, 4°C range, and as high as 90º, 32ºC
Humidity: Average humidity. If the air is dry, mist the plant.
Soil: Use 1 part standard potting mix and 1 part bark or pumice. The pH of the soil needs to be between 5.0 - 7.5. 
Pot: Re-pot every two years, while not flowering, to a larger pot and mix in new soil to fill the gaps.
Pruning: De-head wilted flowers regularly.
Propagation: Propagate by seed or dividing rhizomes.
Poisonous Plant Info: Non-toxic

Source:
https://www.houseplantsexpert.com/beach-spider-lily.html"
begonia coccinea,"The Begonia plant is often considered an outdoor plant, but they make excellent indoor houseplants that can bloom throughout the year.
Begonia plants originate from the tropical, moist regions of southern Asia, Africa, South America, and Central America, and require such high humidity to grow well. 
Each variety has different care requirements, but they all prefer warm temperatures, barely moist soil, and bright, indirect light with no direct sun.
The leaves of some begonia plants have extraordinarily colorful foliage while other varieties have broad green leaves and beautiful flowers. 
It is considered to be a slightly poisonous plant especially to dogs and cats. Keep out of reach of small children and pets.

Source: 
https://www.houseplant411.com/houseplant/begonia-plant-how-to-grow-care-guide","Light: Medium to bright, indirect light.
Water: Allow the top 50% of the soil to dry out, then water.
Fertilizer: Feed monthly with a high phosphorous fertilizer at 1/2 strength.
Temperature: 65°-75°F, 18.3°-23.9°C
Humidity: High humidity. If the air is dry, place the plant on a pebble tray with water, taking care that the plant is not sitting in the water.
Soil: Use a quick-draining, rich, well-aerated soil.
Pot: Use a clay or terra cotta pot to help the soil dry out and prevent root rot.
Pruning: Immediately remove dead leaves, stems, and flowers to help prevent mold and mildew.
Propagation: Propagate from stem tip or leaf cutings.
Poisonous Plant Info: Toxic. Keep out of reach of pets and small children.

Source: 
https://www.houseplant411.com/houseplant/begonia-plant-how-to-grow-care-guide"
begoniaceae,"The Begonia Rex plant is a colorful, perennial, flowering plant that originates from India. The hundreds of hybrid varieties of the Begonia rex sold throughout the world are popular for their large, colorful, patterned leaves that come in a variety of shapes, sizes, and textures.The dramatic color combinations on the leaves of a Begonia Rex set this plant apart from the usual green- leafed houseplant. 
It requires attention and care, which can be a little challenging for beginners.
The Begonia Rex plant is a slightly poisonous plant and toxic to small children, cats, dogs, and other small pets.

Source:
https://www.houseplant411.com/houseplant/begonia-rex-plant-how-to-grow-care-guide","Light: Bright, indirect light. No direct sun.
Water: Allow the top 30-50% of the soil to dry out, then water. Never over-water.
Fertilizer: Spring-Summer: Feed every two weeks as soon as new growth appears with a balanced plant food diluted to 1/4 strength. Feed less in fall. Do not feed during winter.
Temperature: Likes warmth. Do not go below 60°F, 15.6°C.
Humidity: Likes high humidity. However, do not mist the leaves as this can cause a powder mildew. Place on a pebble tray with water, taking care that the plant is not sitting in the water.
Soil: Use a quick-draining, well-aerated soil. 
Pot: Likes a large, shallow pot.
Pruning: Aggressively prune leggy stems.
Propagation: Propagate by stem and leaf cuttings.
Poisonous Plant Info: Mildly poisonous. Keep out of reach of small children and pets.

Source:
https://www.houseplant411.com/houseplant/begonia-rex-plant-how-to-grow-care-guide"
strelitzia reginae,"The Bird of Paradise plant is a striking, easy to care for plant that enjoys warm, balmy days year-round. The most popular species used as an indoor plant is the Strelitzia Reginae, which has very large, oblong, leathery, paddle-shaped green leaves. It can reach a height of 4'-6' and, on rare occasions after 4-5 years, produce exotic-looking flowers called ""crane fowers"" as they resemble the head of a crane. As an outdoor plant, the Bird of Paradise often flower throughout the year, producing 25-30 spikes that can last for weeks.
The plant is native to South Africa with five main types, some of which, due to their size, should only be grown outdoors as landscape plants.
The Bird of Paradise plant is a slightly poisonous plant and can be toxic to small children, cats, dogs, and other pets.

Sources: 
https://www.houseplant411.com/glossary/poisonous-houseplants-reference-book
https://www.houseplantsexpert.com/bird-of-paradise-plant.html","Light: Bright light, even direct sunlight if placed gradually, allowing the leaves to adapt. 
Water: Spring-Summer: Keep soil moist, but never soggy. During fall and winter, needs less water. Water from the bottom so the soil stays loose and well-aerated.
Fertilizer: Spring-Summer: Feed monthly when acitvely growing with a balanced plant food diluted to 1/2 strength. Do not fertilize in fall and winter, during the resting period.
Temperature: 65°-75°F, 18.3°-23.9°C during the spring, summer, and fall. In the winter, during the resting period, keep the temperature 10°F cooler.
Humidity: Average household humidity.
Soil: Use a well-draining basic potting soil.
Pot: Re-pot once the roots have filled the current pot, moving to the next size and nothing larger. Use a pot with drip holes.
Pruning: Remove any dead or damaged leaves and stems; cut close to the soil.
Propagation: Propagate by plant division.
Poisonous Plant Info: Toxic. Keep away from children and pets.

Sources: 
https://www.houseplant411.com/glossary/poisonous-houseplants-reference-book
https://www.houseplantsexpert.com/bird-of-paradise-plant.html"
asplenium nidus,"The slow-growing Bird’s Nest fern, Asplenium nidus, is so named because when new fronds first appear, they resemble little bird eggs, emerging from a fuzzy, brown, central rosette, or crown. The fronds are long, erect, leathery, and apple-green. These tongue-shaped fronds are fragile, so the plant should be placed in a low-traffic area. It's also important to never get water on the rown or the plant to prevent plant diseases. When mature, the plant forms a compact, vase-like shape with leaves around 24"" wide and 16"" tall.
It  is native to the rain forests of Asia, Africa, and Australia and requires warm temperatures and high humidity to thrive.
The plant is non-toxic.

Source: 
https://www.houseplant411.com/houseplant/birds-nest-fern-how-to-grow-care-guide","Light: Medium, indirect light.
Water: Keep soil barely, moist but never soggy.
Fertilizer: Feed once or twice during the spring and summer, when the plant is actively growing, with balanced plant food diluted to 1/2 the strength.
Temperature: 70°-90°F, 21.1°-32.2°C
Humidity: Requires high humidity. Place the plant on a wet pebble tray; be sure the plant is sitting on pebbles and not in the water.
Soil: Use loose, quick-draining. organic soil.
Pot: Once the roots fill the current pot, re-pot to the next size container and nothing larger. Be sure there are drip holes in the bottom.
Pruning: Doesn't require much pruning. Remove any dying leaves.
Propagation: Propagate using the spores that develop on the backs of the fronts.
Poisonous Plant Info: Non-toxic

Source: 
https://www.houseplant411.com/houseplant/birds-nest-fern-how-to-grow-care-guide"
clerodendrum,"The Bleeding Heart plant, is grown for its masses of beautiful bi-colored flowers, with each white flower made up of an inner group, corolla, of bright red petals. It has twining stems with large attractive dark green leaves and can be planted in a hanging basket or with a trellis in the pot.
The plant is native to tropical west Africa and can grow up to 3 feet in length as a houseplant, and, if planted outside in tropical areas, often reaching 15 feet.
The Bleeding Heart plant is a very poisonous plant and should be kept way from small children and pets. 

Source: 
https://www.houseplant411.com/houseplant/bleeding-heart-plant-how-to-grow-care-guide","Light: Bright, indirect light. No direct sun.
Water: Moist in the spring and summer, but not soggy. When resting in the fall and winter, place in a cool location and water infrequently.
Fertilizer: When the plant is actively growing, feed every two weeks with a balanced fertilizer diluted to 1/2 strength.
Temperature: 55°-60°F, 12.8°C-15.6°C
Humidity: High humidity in the spring and summer and normal household humidity the rest of the year.
Soil: Use a quick-draining, rich organic soil.
Pot: Re-pot every year, during the spring, to the next size pot and never anything larger.
Pruning: Prune long, weak stems in the late fall, after the plant has finished blooming.
Propagation: Propagate from stem tip cuttings in the late spring or summer. 
Poisonous Plant Info: Toxic. Small children, small dogs, and other pets should be kept away from this plant.

Source: 
https://www.houseplant411.com/houseplant/bleeding-heart-plant-how-to-grow-care-guide"
neoregelia carolinae,"The Blushing Bromeliad, Neoregelia Carolinae, a species from the bromeliad family, is one of the most commonly grown species from this genus. The Blushing Bromeliad produces a rosette of leaves with a red center. The most popular variety is the tricolor Blushing Bromeliad.
The plant originates from Brazil and in nature, it grows on trees or on the forest floor, collecting water within the center cup (vase).
It is non-toxic

Source: 
https://www.houseplantsexpert.com/blushing-bromeliad.html","Light: Bright light. A combination of some sun and shade provided throughout the day.
Water: Keep soil slightly moist, but not soaked. Water every 4-6 weeks.
Fertilizer: Once a month, add a diluted liquid fertilizer (half strength) to your misting bottle.
Temperature: 65 - 80ºF, 18 - 27ºC
Humidity: Average to above average humidity.
Soil: A well-draining and loose soil mixture such as: 1 part peat, 1 part bark and 1 part coarse sand or perlit.
Pot: Re-pot only when the plant outgrows the current container. Renew soil each year.
Pruning: Remove unhealthy leaves.
Propagation: Once the plant has flowered the mother plant will begin to die and produce pups. When the pups grow roots or are about a third the size of the mother plant, cut the pups off as close to the mother plant as possible.
Poisonous Plant Info: Non-toxic, but can cause skin irritations and contact dermatitis for some people and pets.

Source: 
https://www.houseplantsexpert.com/blushing-bromeliad.html"
nephrolepis exaltata,"The Boston fern, Nephrolepis exalta, are not difficult to grow, but also need care and attention to flourish.  
As the plant is native to tropical forests and swamp areas around the world, especially prevalent in Florida, Mexico, Africa, Central and South America, and Polynesia, high humidity and keeping the soil barely moist are two keys to success.
The wide-spreading Boston fern has long, arching fronds that can be 2'-3' long and 4""-6"" wide. Each frond has small leaflets (pinnae) on either side of a midrib. These leaflets have slightly serrated edges and a deltoid shape.
It is non-toxic.

Source:
https://www.houseplant411.com/houseplant/boston-fern-how-to-grow-care-guide","Light: Bright, indirect light. Keep the plant out of direct sun.
Water: Allow the top 30% of the soil to dry-out, then water.
Fertilizer: Feed monthly when the plant is actively growing with a balanced, liquid fertilizer diluted to 1/4 to 1/2 strength.
Temperature: 60°-70°F, 15.6°-21.1°C
Humidity: High humidity. Try setting your fern on a wet pebble tray. Be sure the fern is sitting on the pebbles and not in the water. Or use a humidifier in the room.
Soil: Use quick-draining, indoor potting soil mixed with a little extra peat moss.
Pot: Likes to be root-bound. When the plant roots outgrow the current pot, repot to the next size pot, no larger.
Pruning: Cut dead fronds off at the base of the stem as soon as they appear.
Propagation: Propagate by by plant division.
Poisonous Plant Info: Non-toxic

Source:
https://www.houseplant411.com/houseplant/boston-fern-how-to-grow-care-guide"
bougainvillea,"The Bougainvillea plant is popular due to its beautiful clusters of bright, paper-like bracts. The colorful bracts surround the actual flower, which is usually small and white. The bracts emerge from thorny, woody, tropical vines, or branches. Bougainvillea flowers appear on branches 18″-20″ long.
A Bougainvillea plant is native to the rain forests of Brazil, Peru, and southern Argentina. 
The Bougainvillie is a very poisonous plant and should be kept way from small children and pets.

Source:
https://www.houseplant411.com/houseplant/bougainvillea-plant-how-to-grow-care-guide","Light: Requires bright full sun for at least 5-6 hours every day in order to bloom.
Water: Allow the top 50% of the soil to dry out, then water.
Fertilizer: Fertilize monthly, when in bloom, with a special bougainvillea or hibiscus plant food.
Temperature: 70°-85°F, 21°-29.4°C during the day and 60°-70°F, 15.6°-21°C at night
Humidity: High humidity, especially when in bloom.
Soil: Use a quick-draining, loamy soil with lots of organic material.
Pot: Large hanging baskets at least 10""-12"" in size or in 5-10 gallon clay planters.
Pruning: Prune to maintain size, removing branches or limbs.
Propagation: Propagate by stem cuttings.
Poisonous Plant Info: Very poisonous. The sap can cause a rash that resembles posion ivy. Wear protective clothing and gloves. Keep away from small children and dogs.

Source:
https://www.houseplant411.com/houseplant/bougainvillea-plant-how-to-grow-care-guide"
impatiens walleriana,"The Busy Lizzie, Impatiens Walleriana, is a popular houseplant within the UK and US. They are grown for their attractive blooms both outdoors and indoors.
The Busy Lizzie requires enough bright light and the correct temperatures to flourish. The maximum growth is approximately 24"" in height. 
The plant originiates from East Africa.
It is non-toxic to cats and dogs.

Source:
https://www.houseplantsexpert.com/busy-lizzie.html","Light: Bright light during winter. Avoid direct sun light during summer.
Water: Keep the soil moist at all times, but not soggy.
Fertilizer: Feed monthly with a balanced liquid fertilizer during spring and summer
Temperature: 65°-75°F, 18.3°-23.8°C
Humidity: Average humidity.
Soil: A well draining potting soil mix.
Pot: Likes small pots. Re-pot during spring if the plant has become pot bound.
Pruning: Pinch stem tips. Once or twice, beginning first in mid-summer, cut back the entire plant by four to six inches if it is leggy.
Propagation: Propagate by stem cuttings or seed.
Poisonous Plant Info: Non-toxic

Source:
https://www.houseplantsexpert.com/busy-lizzie.html"
aechmea fasciata,"A Urn plant, Aechmea fasciata, is an easy care flowering plant, the most popular bromeliad from the Aechmea genus for growing indoors. 
It has thick, arching, gray-green leaves that are arranged in a circular fashion, forming an upturned waxy cup in the center. This central cup acts s a reservoir and collects water and nutrients. After 3-4 years, the plant produces a tall flower stalk, a large flower head with numerous pink bracts, that can last from mid-summer until early-winter.
The Urn plant is native to Brazil.
It is on-toxic to cats and dogs.

Sources: 
https://www.houseplant411.com/houseplant/bromeliad-plant-how-to-grow-care-guide
https://www.houseplantsexpert.com/urn-plant.html","Light: Very bright light in order to flower. Once pink bracts appear, move to lower light.
Water: Keep the flower's cup filled with fresh water, replacing weekly. Allow the top .5"" of soil to dry out, then dampen. Never allow soil to totally dry out.
Fertilizer: Feed monthly in the spring, summer, and fall with a liquid plant food diluted to 1/2 strength. During winter, fertilize a every other month.
Temperature: 60°-75°F, 17°- 24°C
Humidity: Moderate humidity.
Soil: Use a bromeliad or orchid potting soil. Or use equal parts leaf mold, peat moss, and coarse sand or equal parts fir bark, peat moss, and sharp sand or perlite.
Pot: Young and growing: re-pot in a slightly bigger container. Mature: replace the soil once very 2 years, without re-potting.
Pruning: Remove unhealthy leaves.
Propagation: Once the plant has flowered the mother plant will begin to die and produce pups. When the pups grow roots or are about a third the size of the mother plant, cut the pups off as close to the mother plant as possible.
Poisonous Plant Info: Non-toxic, but can cause skin irritations and contact dermatitis for some people and pets.

Sources: 
https://www.houseplant411.com/houseplant/bromeliad-plant-how-to-grow-care-guide
https://www.houseplantsexpert.com/urn-plant.html"
