scientific_name,description,plant_care
beaucarnea recurvata,"The slow-growing, easy care Ponytail Palm is not really a palm at all, but a relative of the Yucca and Lily plants and a member of the Agave family. 
There are no two ponytail palms that are exactly alike. The plant has a large, swollen base that some say resembles an elephant’s foot, and a thin trunk topped with flat, dark green, grass-like leaves. The leaves are about an inch wide and often 5'-6' long with sharp edges.
The plant is non-toxic.

Source:
https://www.houseplant411.com/houseplant/ponytail-palm-plant-how-to-grow-care-guide","Light: Very bright, indirect light or full sun.
Water: Do not overwater. Allow the top 50-70% of the soil to dry, then water. During warm months, water every 7-14 days; in winter, every 3-4 weeks.
Fertilizer: Spring-Summer: Feed monthly with a basic houseplant food diluted to 1/2 the recommended strength.
Temperature: Like warm temperatures above 60°F, 15.6°C.
Humidity: Does well in warm, dry air.
Soil: Use a fast-draining, light soil with a lot of sand in it to prevent over-watering.
Pot: Keep in a small pot to keep the plant small. When moved to a larger pot, the Palm grows faster and the trunk can expand.
Pruning: Trim the brown ends off leaves with wet scissors.
Propagation: Propagate bu separating offsets or suckers that grow around the base of the plant.
Poisonous Plant Info: Non-toxic

Source:
https://www.houseplant411.com/houseplant/ponytail-palm-plant-how-to-grow-care-guide"
epipremnum aureum,"Pothos plants are highly-adaptable, hardy, easy to care for plants that are good for beginners as long as they are careful not to over-water. The leaves of the pothos come in a variety of colors and leaf patterns, depending on the variety. Indoors, they can be potted, hung in a basket, or attached to a pole or board for support.
The plant originates from the jungles of Malaysia, China, Australia, and islands in the Pacific and Indian Oceans. 
Pothos plants are considered poisonous. A pothos plant is toxic to dogs, cats, and children; and the long vines should be kept out of reach.

Source: 
https://www.houseplant411.com/houseplant/pothos-plant-how-to-grow-care-guide","Light: There is a pothos plant variety for almost any light situation: The lighter the colors in the leaves of a pothos plant, the more light the plant requires.
Water: Water well and then allow the top 50% of the soil to dry out then water again. Do not over-water.
Fertilizer: Feed every two weeks in the spring and summer when the plant is actively growing, with well-balanced plant food diluted to 1/2 strength. Feed monthly in the fall and winter.
Temperature: 55°-80°F, 12.8°-26.7°C
Humidity: Average humidity.
Soil: Use a quick-draining, well-aerated potting soil.
Pot: Likes to be root-bound in a small pot. Only move to a slightly larger container once the roots have filled the current container. Make sure the pot has drip holes.
Pruning: Aggressively prune long vines to keep the plant looking full and bushy.
Propagation: Propagate by stem cuttings.
Poisonous Plant Info: Toxic. Keep out of reach of small children and pets.

Source: 
https://www.houseplant411.com/houseplant/pothos-plant-how-to-grow-care-guide"
maranta leuconeura,"The prayer plant (Maranta leuconeura) is primarily grown as an indoor plant. At night, the leaves of a prayer plant fold up as though praying and, in the morning, as the plant reaches for the light, the leaves unfurl and open again. 
Prayer Plants are native to tropical Central and South America and the West Indies.
The plant is non-toxic.

Source: 
https://www.houseplant411.com/houseplant/prayer-plant-how-to-grow-care-guide
","Light: Medium to high light. No direct sun.
Water: Keep the soil barely moist but never soggy at all times. Water less in the winter when the plant is resting.
Fertilizer: An acid-loving houseplant, feed every two weeks in the spring and summer with a food like Miracid diluted to 1/2 strength. It’s not necessary to feed a prayer plant in the winter and fall.
Temperature: 60°-80°F, 15.6°-26.7°C
Humidity: High humidity. Place plant on a pebble tray filled with water. Be sure the plant is sitting on the pebbles and not in the water.
Soil: Use a quick-draining, well-aerated, peat-based, indoor potting soil that retains water.
Pot: Because of its very short roots, use a shallow pot that has drip holes in the bottom.
Pruning: Trim stems twice a year to keep the plant compact and bushy.
Propagation: Propagate by plant division and stem cuttings.
Poisonous Plant Info: Non-toxic

Source: 
https://www.houseplant411.com/houseplant/prayer-plant-how-to-grow-care-guide"
gynura aurantiaca,"The Purple Velvet plant (Gynura aurantiaca), is both an outdoor woody perennial that can often grow up to 4 ft. wide and 2-3ft in height as well as an indoors plant with beautifully-shaped green leaves covered in velvety purple hairs and areddish-purple underside. The Purple Velvet plant produces small yellow/orange flowers that have an offensive smell and should probably be removed as soon as they appear.
The plant originated in Indonesia and requires bright light and aggressive pruning to keep it looking good. 
Although the plant is listed as non-poisonous, some people have an allergic reaction from touching the plant.

Source:
https://www.houseplant411.com/houseplant/purple-velvet-plant-how-to-grow-care-guide
","Light: Bright, indirect light.
Water: Allow the top 25% of the soil to dry out, then water. Do not overwater due to root rot.
Fertilizer: Spring-Summer: Feed weekly when actively growing with a balanced fertilizer diluted to 1/2 strength. Feed monthly in the fall and every other month during the winter, when the plant is in its resting period.
Temperature: 65°-85°F, 18.3°-29.4°C
Humidity: Likes high humidity
Soil: Use a quick-draining, basic indoor potting soil that retains moisture.
Pot: Keep root-bound in small pots. Make sure there are drainage holes in the bottom of the pot.
Pruning: Aggressively prune before the plant starts to get long and leggy.
Propagation: Propagate with stem cuttings rooted in water or planted in soil.
Poisonous Plant Info: Listed as non-poisonous, some people have an allergic reaction from touching the plant.

Source:
https://www.houseplant411.com/houseplant/purple-velvet-plant-how-to-grow-care-guide"
hemigraphis alternata,"The Purple Waffle plant, Hemigraphis alternata, is a easy care plant that is perfect for beginners. It gets its name because of the”puckered” appearance of its shiny, dark-green leaves that have a purple underside. The compact plant grows only about 6”-8” tall but can produce stems 12” to 24” long.
The Purple Waffle plant originated in the jungles of Java.
It is non-toxic

Source:
https://www.houseplant411.com/houseplant/purple-waffle-plant-how-to-grow-care-guide
","Light: Medium to bright, indirect light. No direct sun.
Water: Keep soil barely moist, but not soggy. Water less in winter.
Fertilizer: Late-March-September: Feed monthly with a high phosphate plant food diluted to 1/2 strength. Make sure the soil is moist when feeding.
Temperature: 55°-75°F, 12.8°–23.9°C
Humidity: Prefers high humidity. If the air is dry, set the plant on a wet pebble tray, making sure the plant is not sitting in the water.
Soil: Use a quick-draining, rich, organic soil full of peat moss.
Pot: When the roots have filled the current pot, re-pot to the next slightly larger size pot.
Pruning: Pinch the stem tips.
Propagation: Propagate during spring and summer by 4""-6"" long stem tip cuttings, cut just below a node in the stem.
Poisonous Plant Info: Non-toxic

Source:
https://www.houseplant411.com/houseplant/purple-waffle-plant-how-to-grow-care-guide"
phoenix roebelenii,"The Dwarf Pygmy Date palm, Phoenix roebelenii, does well in indirect light and grows very slowly, reaching a maximum indoors height of 5'-5'. The plant produces graceful, arching fronds that are about 3' long, from a central trunk. Like other palms, the Dwarf Pygmy Date palm is an excellent clean air plant.
The plant originated underneath the canopy of dense tropical forests in Africa and Asia. 
It is on-toxic.

Source:
https://www.houseplant411.com/houseplant/pygmy-date-palm-how-to-grow-care-guide","Light: Bright, indirect light. Can survive in medium light, without over-watering.
Water: Keep soil moist, but never soggy. In winter, allow the soil to dry out, then water.
Fertilizer: Feed once in spring and summer with a time-released fertilizer such as Rose fertilizer.
Temperature: 50°-75°F, 16°-24°C
Humidity: Moderate to high humidity.
Soil: Use a basic, well-draining indoor potting soil.
Pot: Repot immature plants every few years in the Spring. Mature plants have very delicate roots that don't like to be disturbed. Keep in the same container and replace the top few inches of soil each year.
Pruning: Remove old fronds. Wear gloves due to the sharp spines at the base of the leaflets.
Propagation: Propagate using the suckers that develop at the plant's base.
Poisonous Plant Info: Non-toxic

Source:
https://www.houseplant411.com/houseplant/pygmy-date-palm-how-to-grow-care-guide"
billbergia nutans,"
Queens Tears, Billbergia Nutans, are popular for their brilliant flower colors. The plant is easy to split and share, which has earned it the nickname ""Friendship plant"". 
The Queens Tears are among the most common to find of the bromeliad family; it is native of Brazil, Uruguay and Argentina grows well in many American homes.
The plant has an average lifespan of three years.
It is non-toxic.

Source: 
https://www.houseplantsexpert.com/queens-tears-plant.html","Light: Summer: partial shade. Fall-Spring: bright, indirect light.
Water: Summer: water the leaves, flowers, and roots daily, keeping soil moist, but not soggy. Fall-Spring: mist the plant every few days and water just enough to keep the soil just shy of dry.
Fertilizer: Summer: feed every other week with a balanced fertilizer. Flower cups can be filled with liquid fertilizer. Fall-Spring, feed once a month.
Temperature: Summer: 65º-80ºF, 18º-27ºC. Fall-Spring: 60º-75ºF, 16º-24ºC temperature. Coldest Winter: can withstand up to 40ºF, 4ºC, for occasional periods.
Humidity: Summer: high humidity. Mist the leaves and flowers daily.
Soil: Use orchid or bromeliad mixture or one part gardening soil and two parts perlite or tree bark.
Pot: Re-pot before flowering, using a larger pot each time until the pot is 5"" across.
Pruning: Remove yellow or dying leaves.
Propagation: After flowering, new shoots can be broken-off from the main plant and uprooted, then transferred to their own pot.
Poisonous Plant Info: Non-toxic

Source: 
https://www.houseplantsexpert.com/queens-tears-plant.html"
davillia fejeensis,"The Rabbit’s Foot fern, Davillia fejeensis, is a unique looking, low maintenance, compact plant. It has lacy, leathery, medium-green, arching fronds with a bluish tinge.  As the plant matures, it develops furry, rhizomes (fleshy roots) that grow on the surface, covered in brown hairs that make them look like the feet of a rabbit.
The plant originates from Southeast Asia and Fiji.
It is non-toxic.

Source: 
https://www.houseplant411.com/houseplant/rabbits-foot-fern-how-to-grow-care-guide","Light: Medium light by a north- or east-facing window. Avoid south- and west- facing windows. No direct sun.
Water: Likes to be a little drier than most other indoor ferns. Allow the top 25% of the soil to dry out, then water.
Fertilizer: Spring-Fall: feed every 2 weeks with a balanced plant food diluted to 1/2 strength, only when it is actively growing.
Temperature: 65°-75°F, 18.3°- 23.9°C during the day and 10°F cooler at night.
Humidity: Can adjust to low humidity. Prefers 40-50% humidity.
Soil: Use 1 part peat-moss and 1 part chopped bark. 
Pot: Re-pot every few years when the roots have filled the current pot.
Pruning: Pruning is rarely necessary. Removy any brown fronds as soon as they appear.
Propagation: Propagate with plant division, dividing the rhizomes, ensuring that there is a piece of stem attached to each rhizome.
Poisonous Plant Info: non-toxic

Source: 
https://www.houseplant411.com/houseplant/rabbits-foot-fern-how-to-grow-care-guide"
calathea lancifolia,"The Rattlesnake Plant, Calathea Lancifolia, is a popular, easy to care for houseplant for growers wanting tropical themed foliage. The waxy, green leaves sport dark green circles and striking purple undersides. 
As the plant is native to Brazil, it thrives in warm and moist areas.
It is non-toxic.

Source:
https://www.houseplantsexpert.com/rattlesnake-plant.html","Light: Bright, indirect light. 
Water: May-August: During the growing season, water frequently, always keeping the soil most, but not soggy. During the winter, only water when the top soil becomes dry to the touch.
Fertilizer: Use a balanced liquid fertilizer, feed once a month from April-August.
Temperature: 65º-75ºF, 18º-24ºC and no lower than 60ºF, 15ºC.
Humidity: Loves high humidity. Place on a pebble tray with water, making sure that the plant does not sit in the water.
Soil: Use well-draining soil that retains water such as 2 parts peat and 1 part perlite.
Pot: Re-pot after outgrowing the current pot by transferring to a wider pot. If there is no wider pot, divide the plant and re-pot.
Pruning: Remove damaged and dead leaves.
Propagation: Propagate with plant division.
Poisonous Plant Info:

Source:
https://www.houseplantsexpert.com/rattlesnake-plant.html"
rhapis excelsa,"The elegant, slow-growing Lady Palm is a durable, easy care plant that adapts to almost all conditions. It has large, shiny, dark-green fronds with blunt tips. These fronds grow out of multiple sturdy stems covered in a hairy brown fiber.
Potted in 6""-8"" containers, the compact upright palm is a great desk plant. In 10"" and larger containers, the Lady Palm can grow up to 14' tall.
The plant is non-toxic.

Source:
https://www.houseplant411.com/houseplant/rhapis-palm-how-to-grow-care-guide","Light: Bright, indirect light. Can adapt to low light. 
Water: Allow the top 50% of the soil to dry out, then water.
Fertilizer: Needs very little fertilizer. Feed every other month when actively growing with balanced plant food diluted to 1/4 strength.
Temperature: 50°-80° F, 10°-26.7°C.
Humidity: Adjusts to both dry and humid environments
Soil: Use a quick-draining, dense soil and add additional humus, if needed. African Violet soil works well.
Pot: Likes to be root-bound in small pots. When re-potting, cover all the roots and bases of the canes.
Pruning: Remove dark brown or withered leaves.
Propagation: Propagate by plant division.
Poisonous Plant Info: Non-toxic

Source:
https://www.houseplant411.com/houseplant/rhapis-palm-how-to-grow-care-guide"
rosa chinensis minima,"The Miniature Rose Bush plant are hybrids that are difficult to keep indoors permanently. To prolong its life, plant the miniature rose bush plant outdoors in the fresh air and bright light. 
The plant produces small 1”-2” flowers in red, yellow, pink, white, peach, and orange. 
The plant has its origins in China.
It is non-toxic.

Source:
https://www.houseplant411.com/houseplant/miniature-rose-bush-plant-how-to-grow-plant-care-tips","Light: Very bright light with several hours of direct sun.
Water: Requires a great deal of water, especailly while flowering. Check the soil every few days. Allow the top 1"" of soil to dry out, then water. During winter, keep the soil barely most. Do not get water on the leaves as this can lead to fungus growth.
Fertilizer: Spring-Summer: feed every two weeks with a high phosphorous fertilizer at 1/2 strength
Temperature: 60°-75°F, 16°-24°C.
Humidity: Moderate to high humidity. If the air is dry, place in a pebble tray with water, taking care that the plant does not sit in the water.
Soil: Use moist potting soil.
Pot: Keep in small pots to avoid root rot and stunted growth.
Pruning: Remove dead branches and branches that rub against each other. After the plant has finished blooming in the fall, prune the bush to encourage new growth the next season.
Propagation: Propagate by stem tip cuttings in early summer.
Poisonous Plant Info: non-toxic

Source:
https://www.houseplant411.com/houseplant/miniature-rose-bush-plant-how-to-grow-plant-care-tips"
calathea roseopicta,"The Rose Painted Calathea is an undemanding plant that is primarily kept for it's tropical looking patterned leaves, with purplish colored undersides.
Just like other species from the Calathea genus, they're easy to care for.
The Rose Painted Calathea originates from  Brazil.
It is non-toxic.

Source: 
https://www.houseplantsexpert.com/rose-painted-calathea.html","Light: Bright, indirect sunlight. No direct sun. Place at a north-, east-, or west-facing windows.
Water: Keep soil moist at all times.
Fertilizer: Use a balanced, diluted solution every 2 weeks, April-early October.
Temperature: 65º-75ºF, 18º-24ºC are suitable, and no lower than 60ºF, 15ºC
Humidity: Likes high humidity. Mist daily and place the plant pot on a pebble tray with water, making sure the plant doesn't sit in the water.
Soil: Use a peat-based potting mix: 2 parts peat and 1 part perlite.
Pot: Re-pot during spring every two years. Re-pot to only a slightly larger pot once the roots have filled the current pot.
Pruning: Prune dead leaves.
Propagation: Propagate by plant division in mature plants. Do not over-water the divided plants.
Poisonous Plant Info: Non-toxic

Source: 
https://www.houseplantsexpert.com/rose-painted-calathea.html"
cycas revoluta palm,"The elegant, slow-growing Sago Palm, Cycad, is not really a palm, but a type of gymnosperm and relatives of conifers and gingko trees. Cycads are often called “living fossils,” are one of the oldest most primitive plant families and have not changed very much in the last 200 million years. 
The plant has a very rugged trunk 1”- 12” in width, depending upon the age of the plant. The trunk is topped with stiff, somewhat narrow, long, arching fronds that grow in a circular or rosette pattern. Care should be taken to avoid being stuck by the sharp tips of the fronds.
All parts of the Sago Palm are very poisonous and toxic to cats, dogs, and humans. It should be kept away from pets and children. 

Source:
https://www.houseplant411.com/houseplant/sago-palm-how-to-grow-care-guide



","Light: Bright light with a little direct sun in the morning only. Direct afternoon sun burns the leaves. Give 1/4 turn every week to keep from growing toward the light.
Water: The plant is drought resistant. Allow the top 75% of the soil to dry out, then water the plant thoroughly, making sure the water comes out the drip holes in the bottom of the pot. Do not allow the plant to sit in excess water. In winter, water sparingly. Do not allow water to get in the crown of the Sago palm as this can cause rot disease and eventual death.
Fertilizer: Spring-Fall: feed monthly with a liquid fertilizer diluted to 1/2 strength.
Temperature: 60°-75° F, 16°-24° C)
Humidity: Likes high humidity. Place a humidifier near the plant if the air is dry.
Soil: Use loose, quick-draining soil such as a cactus or succulent soil.
Pot: Only repot when the plant has outgrown the existing pot, as the roots do not like to be disturbed.
Pruning: Remove dead or damaged fronds that have turned completely brown. Cut from the very bottom of the plant.
Propagation: Propagate through plant division. 
Poisonous Plant Info: All parts are very poisonous, especially the seeds. Keep out of reach of children and pets.

Source:
https://www.houseplant411.com/houseplant/sago-palm-how-to-grow-care-guide"
guzmania lingulata,"The Scarlet Star is a popular bromeliad species grown for it's green leathery foliage and bright red or orange bract. It takes 3-4 years to mature to the blooming stage. They produce a single cup-like bloom once in their life time.
These plants can be potted or can survive attached to a host plant without causing the host plant harm. 
Guzmania lingulata is a native of Middle and South America.
The Scarlet Star is poisonous. Keep away from small children and pets.

Source: 
https://www.houseplantsexpert.com/bromeliad-scarlet-star.html","Light: Bright, indirect light. No direct sunlight as it can cause the leaves to burn and damage the flowers.
Water: Mist roots on a daily basis. Allow soil to dry completely, then water to the point of wet, but never soggy. Do not allow water to sit in the plant tray. Keep the cup of the flower filled with 1""-2"" of water at all times, refreshing the water every four days. Use distilled or rain-sourced water; the chemicals in processed water will kill the plant.
Fertilizer: When blooming, once a month, feed the plant a balanced fertilizer mix diluted to 1/2 strength, delivered directly to the flower cup. Pour out the fertilizer after 4-5 days and replace with regular water.
Temperature: 65°-80°F, 18°-27°C
Humidity: High humidity. If your home has average humidity, spray the leaves and flower cup with a light dose of water, every day.
Soil: Use one part soil to one part pumice or bark. Drainage must be good throughout all the stages of the plant's life. 
Pot: Re-pot every spring to the next larger size until the plant resides in a 6"" or 8"" pot. Once the plant has matured, there is no need to re-pot.
Pruning: Remove yellow or dying leaves.
Propagation: Break off small shoots from near the base once of the plant once they have reached three"" height. Propagate in separate containers.
Poisonous Plant Info: Poisonous. Keep away from small children and pets.

Source: 
https://www.houseplantsexpert.com/bromeliad-scarlet-star.html"
paphiopedilum,"Known as ""Slipper Orchids"" due to the appearance of their pouch (the center section of flower) resembling a slipper, The Paphiopedilum are easy to grow orchids that grow in a range of different colors.
The Paphiopedilum orginiates from Asia and Southeast Asia in countries such as India and the Philippines. There are more than 80 different species and many hybrids.
They are non-toxic.

Source: 
https://www.houseplantsexpert.com/paphiopedlium-slipper-orchid.html","Light: Diminished light; no direct sunlight. Place at a east- or west-facing window, or south-facing window that without direct sunlight.
Water: Every 3-7 days. Water in the morning to allow the water to evaporate from the foliage throughout the day, preventing fungus and rot.
Fertilizer: Give a 1/4 strength balanced fertilizer.
Temperature: 70º-80ºF, 21º-26.5ºC during the day and around 55º-65ºF, 12.5º-18ºC during the night
Humidity: Dislikes dry air. To improve humidity, place the plant on a pebble tray with water; do not let the plant sit in the water.
Soil: Use a medium grade orchid bark mix.
Pot: Re-pot in the spring or early summer or autumn when the temperatures are warmer. When re-potting, pot the oldest growth close to the rim of the pot to allow for another two years of growth. Plants with a large number of growths can be divided.
Pruning: After the bloom fades and the stem turns brown, prune at the base of the stem.
Propagation: Propagate by planting offshoots that have a solid root system.
Poisonous Plant Info: Non-toxic.

Source: 
https://www.houseplantsexpert.com/paphiopedlium-slipper-orchid.html"
sansevieria trifasciata,"The Sansevieria is a hardy, almost impossible to kill houseplant that is good for beginners. It is also known as a ""clean air"" plant and helps rid the air of pollutants.
The plant can grow in light ranging from shade to bright light, is not harmed by low humidity or cold drafts, rarely needs repotting, and is drought resistant.
It is also known by the common names: Snake plant,Mother-in-law's Tongue, Bowstring Hemp, and Devil's Tongue.
The Sansevieria originates from Africa and Southern Asia. 
It is mildly toxic and should be kept away from small children and pets.

Source: 
https://www.houseplant411.com/houseplant/sansevieria-plant-how-to-grow-care-guide","Light: Fares well in all light. The better the light, the faster the plant grows.
Water: Do not over-water; over-watering is the main reason a Sansevieria plant dies. Allow the soil to practically dry out, then water. During winter, water only once every month or two.
Fertilizer: When actively growing, fertilize monthly with cactus plant food diluted to 1/2 strength. Never use fertilizer containing nitrates.
Temperature: 60°-85° F, 15.5°-29°C
Humidity: Low-average household humidity.
Soil: Use rich, organic soil that drains quickly. Add some builders sand if the soil isn't draining well and appears heavy and clay-like.
Pot: Keep root-bound in a small pot with drain holes.
Pruning: Using a sharp, sterile knife, remove too-tall or damaged leaves.
Propagation: Propagate by plant division, leaf cuttings, and offsets growing at the base of the plant.
Poisonous Plant Info: Mildly poisonous. Keep away from small children and pets.

Source: 
https://www.houseplant411.com/houseplant/sansevieria-plant-how-to-grow-care-guide"
